qd1,qd2,question1,question2,label
2331,2332,john gielgud used to say that there were times he wished he were like a painter or a writer,then he could retrieve the bad performance he gave that evening and take it out at midnight and redo it,routh
2333,2334,but he could not,he had to do it there,routh
2335,2336,gielgud went through a very bad time when he could do nothing right,so did olivier,routh
2337,2338,olivier went through a terrible period,he had a terrible problem,routh
2339,2340,he could not look any of the other actors in the eye,he told the other actors please do not look at me because it will throw me,routh
2341,2342,for a while he could not be alone on the stage,he said to the other actors  hado not leave me alone out there,routh
2343,2344,i know the stories jerry,i have heard them all,routh
2345,2346,they do not have to do with me,in the past i never had more than two or three bad nights when i could not recover,routh
2347,2348,for two or three nights i would think i know i am good i am just not doing it,maybe nobody in the audience knew it but i knew itit was not there,routh
2349,2350,and on those nights when it is not there for you it is a labor i know that and yet somehow you get by,you can get very good at getting by on what you get by on when you do not have anything else,routh
2351,2352,but that is something different entirely,when i had a truly wretched performance i would lie awake all night afterward thinking i have lost it i have no talent i ca not do anything,routh
2353,2354,hours would go by but then all of a sudden at five or six in the morning i had understand what went wrong and i could not wait to get to the theater that evening and go on,and i had go on and i could not make a mistake,routh
2355,2356,a beautiful feeling,there are days when you ca not wait to get there when the marriage between you and the role is perfect and there is never a time when you are not happy to sail out onto the stage,routh
2357,2358,those are important days,and for years i had them one after the other,routh
2359,2360,well that is over,now if i were to go out on the stage i would not know what i was out there for,routh
2361,2362,would not know where to begin,in the old days i had do three hours of preparation in the theater for an eight oclock curtain,routh
2363,2364,by eight i was deeply inside that roleit was like a trance like a useful trance,in the family reunion i was in the theater two and a half hours before the first entrance working up to how to enter when you are pursued by the furies,routh
2365,2366,that was hard for me but i did it,you can do it again jerry said,routh
2367,2368,you are forgetting who you are and what you have achieved,your life has hardly come to nothing,routh
2369,2370,endlessly you would do things on the stage in a way i never expected and over the years that was thrilling thousands of times for the audience and always thrilling for me,you went as far away as possible from the obvious thing that any other actor would do,routh
2371,2372,you could not be routine,you wanted to go everywhere,routh
2373,2374,out out out as far out as you could go,and the audience believed in you in every moment wherever you took them,routh
2375,2376,sure nothing is permanently established but so is nothing permanently lost,your talent is been mislaid that is all,routh
2377,2378,no it is gone jerry,i ca not do any of it again,routh
2379,2380,you are either free or you are not,you are either free and it is genuine it is real it is alive or it is nothing,routh
2381,2382,i am not free anymore,okay let is have some lunch then,routh
2383,2384,and put the flowers in some water,the house looks fine,routh
2385,2386,you look fine,a little too slimmed down i would say but you still look like yourself,routh
2387,2388,you are eating i hope,i eat,routh
2389,2390,but when they sat down to lunch in the kitchen with the flowers in a vase between them axler was unable to eat,he saw himself stepping out on the stage to play james tyrone and the audience bursting into laughter,routh
2391,2392,the anxiety and fear were as naked as that,people would laugh at him because it was him,routh
2393,2394,what do you do with the days,jerry asked,routh
2395,2396,walk,sleep,routh
2397,2398,stare into space,try to read,routh
2399,2400,try to forget myself for at least one minute of each hour,i watch the news,routh
2401,2402,i am up to date on the news,who do you see,routh
2403,2404,you,this is no way for someone of your accomplishment to live,routh
2405,2406,you were kind to come all the way out here jerry but i ca not do the play at the guthrie,i am finished with all that,routh
2407,2408,you are not,you are scared of failing,routh
2409,2410,but that is behind you,you do not realize how onesided and monomaniacal your perspective has become,routh
2411,2412,did i write the reviews,did this monomaniac write those reviews,routh
2413,2414,did i write what they wrote about my macbeth,i was ludicrous and they said as much,routh
2415,2416,i would just think i got through that line thank god i got through that line,i would try to think that was not as bad as last night when in fact it was worse,routh
2417,2418,everything i did was false raucous,i heard this horrible tone in my voice and yet nothing could stop me from fucking up,routh
2419,2420,hideous,hideous,routh
2421,2422,i never gave a good performance not one,so you could not do macbeth to your satisfaction,routh
2423,2424,well you are not the first,he is a horrible person for an actor to live with,routh
2425,2426,i defy anyone to play him and not be warped by the effort,he is a murderer he is a killer,routh
2427,2428,everything is magnified in that play,frankly i never understood all that evil,routh
2429,2430,forget macbeth,forget those reviews jerry said,routh
2431,2432,it is time to move on,you should come down to new york and begin to work in his studio with vincent daniels,routh
2433,2434,you wo not be the first whose confidence he is restored,look you have done all that tough stuff shakespeare the classicsthere is no way this can happen to you with your biography,routh
2435,2436,it is a momentary loss of confidence,it is not a matter of confidence replied axler,routh
2437,2438,i always had a sneaking suspicion that i have no talent whatsoever,well that is nonsense,routh
2439,2440,that is the depression talking,you hear actors saying it a lot when they are down the way you are,routh
2441,2442,i do not have any real talent,i can memorize the lines,routh
2443,2444,that is about it,i have heard it a thousand times,routh
2445,2446,no listen to me,when i was fully honest with myself i had think okay all right i have a modicum of talent or i can at least imitate a talented person,routh
2447,2448,but it was all a fluke jerry a fluke that a talent was given to me a fluke that it was taken away,this life is a fluke from start to finish,routh
2449,2450,oh stop this simon,you can still hold attention the way a big star actor does on the stage,routh
2451,2452,you are a titan for god is sake,no it is a matter of falseness sheer falseness so pervasive that all i can do is stand on the stage and tell the audience i am a liar,routh
2453,2454,and i ca not even lie well,i am a fraud,routh
2455,2456,and that is more nonsense,think for a moment of all the bad actorsthere are lots of them and they somehow get by,routh
2457,2458,so to tell me that simon axler jerry said with his talent ca not get by is absurd,i have seen you in the past times when you were not so happy times when you were in psychic torment in every other way but put a script in front of you allow you to access this thing that you do so wonderfully allow you to become another person and always it is been liberating for you,routh
2459,2460,well that is happened before and it can happen again,the love of what you do wellit can return and it will return,routh
2461,2462,look vincent daniels is an ace at dealing with problems like yours a tough canny intuitive teacher highly intelligent and a scrapper himself,i know his name he told jerry,routh
2463,2464,but i have never met him,i never had to meet him,routh
2465,2466,he is a maverick he is a scrapper and he will get you back to contending,he will put the fight back in you,routh
2467,2468,he will start from scratch if he has to,he will get you to give up everything you have done before if he must,routh
2469,2470,it will be a struggle but in the end he will get you back to where you should be,i have been to his studio and watched vincent work,routh
2471,2472,he says  hado one moment,we are only dealing with the single moment,routh
2473,2474,play the moment play whatever plays for you in that moment and then go on to the next moment,it does not matter where you are going,routh
2475,2476,do not worry about that,just take it moment moment moment moment,routh
2477,2478,the job is to be in that moment with no concern about the rest and no idea where you are going next,because if you can make one moment work you can go anywhere,routh
2479,2480,now it sounds i know like the simplest notion and that is why it is hardit is so simple that it is the thing that everybody misses,i believe that vincent daniels is the perfect man for you right now,routh
2481,2482,i have complete faith in him for you in your predicament,here is his card,routh
2483,2484,i came up here to give you this,jerry handed him the business card and so he took it at the same time that he said ca not do it,routh
2485,2486,what will you do instead,what will you do about all the roles you are ripe to play,routh
2487,2488,it breaks my heart when i think of all those parts you were made for,if you accepted the role of james tyrone then you could work with vincent and find your way through it with him,routh
2489,2490,this is the work he does with actors every day,i ca not count the number of times at the tonys or the oscars that i heard the winning actor say i want to thank vincent daniels,routh
2491,2492,he is the best,in response axler simply shook his head,routh
2493,2494,look jerry said everyone knows the feeling i ca not do it everyone knows the feeling that they will be revealed to be falseit is every actor is terror,they have found me out,routh
2495,2496,i have been found out,let is face it there is a panic that comes with age,routh
2497,2498,i am that much older than you and i have been dealing with it for years,one you get slower,routh
2499,2500,in everything,even in reading you get slower,routh
2501,2502,if i go fast in reading now too much of it goes away,my speech is slower my memory is slower,routh
2503,2504,all these things start to happen,in the process you start to distrust yourself,routh
2505,2506,you are not as quick as you used to be,and especially if you are an actor,routh
2507,2508,you were a young actor and you memorized scripts one after the other after the other and you never even thought about it,it was just easy to do,routh
2509,2510,and then all of a sudden it is not as easy and things do not happen so fast anymore,memorizing becomes a big anxiety for stage actors going into their sixties and seventies,routh
2511,2512,once you could memorize a script in a daynow you are lucky to memorize a page in a day,so you start to feel afraid to feel soft to feel that you do not have that raw live power anymore,routh
2513,2514,it scares you,with the result as you say that you are not free anymore,routh
2515,2516,there is nothing happeningand that is terrifying,jerry i ca not go on with this conversation,routh
2517,2518,we could talk all day and to no avail,you are good to come and see me and bring me lunch and flowers and to try to help me and encourage me and comfort me and make me feel better,routh
2519,2520,it was tremendously thoughtful,i am pleased to see you looking well,routh
2521,2522,but the momentum of a life is the momentum of a life,i am now incapable of acting,routh
2523,2524,something fundamental has vanished,maybe it had to,routh
2525,2526,things go,do not think that my career is been cut short,routh
2527,2528,think of how long i lasted,when i started out in college i was just fooling around you know,routh
2529,2530,acting was a chance to meet girls,then i took my first theatrical breath,routh
2531,2532,suddenly i was alive on the stage and breathing like an actor,i started young,routh
2533,2534,i was twentytwo and came to new york for an audition,and i got the part,routh
2535,2536,i began to take classes,sensememory exercises,routh
2537,2538,practice making things real,before your performance create a reality for yourself to step into,routh
2539,2540,i remember that when i began taking class we had have a pretend teacup and pretend to drink from it,how hot is it how full is it is there a saucer is there a spoon are you going to put sugar in it how many lumps,routh
2541,2542,and then you sip it and others were transported by this stuff but i never found any of it helpful,what is more i could not do it,routh
2543,2544,i was no good at the exercises no good at all,i had try to do this stuff and it never would work,routh
2545,2546,everything i did well was coming out of instinct and doing those exercises and knowing those things were making me look like an actor,i would look ridiculous as i held my pretend teacup and pretended to drink from it,routh
2547,2548,there was always a sly voice inside me saying there is no teacup,well that sly voice has now taken over,routh
2549,2550,no matter how i prepare and what i attempt to do once i am on the stage there is that sly voice all the timethere is no teacup,jerry it is over i can no longer make a play real for people,routh
2551,2552,i can no longer make a role real for myself,after jerry had left axler went into his study and found his copy of long day is journey into night,routh
2553,2554,he tried to read it but the effort was unbearable,he did not get beyond page 4he put vincent daniels is card there as a bookmark,routh
2555,2556,at the kennedy center it was as though he had never acted before and now it was as though he had never read a play beforeas though he had never read this play before,the sentences unfolded without meaning,routh
2557,2558,he could not keep straight who was speaking the lines,sitting there amid his books he tried to remember plays in which there is a character who commits suicide,routh
2559,2560,hedda in hedda gabler julie in miss julie phaedra in hippolytus jocasta in oedipus the king almost everyone in antigone willy loman in death of a salesman joe keller in all my sons don parritt in the iceman cometh simon stimson in our town ophelia in hamlet othello in othello cassius and brutus in julius caesar goneril in king lear antony cleopatra enobarbus and charmian in antony and cleopatra the grandfather in awake and sing,ivanov in ivanov konstantin in the seagull,routh
2561,2562,and this astonishing list was only of plays in which he had at one time performed,there were more many more,routh
2563,2564,what was remarkable was the frequency with which suicide enters into drama as though it were a formula fundamental to the drama not necessarily supported by the action as dictated by the workings of the genre itself,deirdre in deirdre of the sorrows hedvig in the wild duck rebecca west in rosmersholm christine and orin in mourning becomes electra both romeo and juliet sophocles ajax,routh
2565,2566,suicide is a subject dramatists have been contemplating with awe since the fifth century b,c,routh
2567,2568,beguiled by the human beings who are capable of generating emotions that can inspire this most extraordinary act,he should set himself the task of rereading these plays,routh
2569,2570,yes everything gruesome must be squarely faced,nobody should be able to say that he did not think it through,routh
2571,2572,jerry had brought a manila envelope containing a handful of mail addressed to him in care of the oppenheim agency,there was a time when a dozen letters from fans would come to him that way every couple of weeks,routh
2573,2574,now these few were all that had arrived at jerry is during the past half year,he sat in the living room idly tearing the envelopes open reading each letter is first few lines and then balling the page up and throwing it onto the floor,routh
2575,2576,they were all requests for autographed photosall but one which took him by surprise and which he read in its entirety,i do not know if you will remember me the letter began,routh
2577,2578,i was a patient at hammerton,i had dinner with you several times,routh
2579,2580,we were in art therapy together,maybe you wo not remember me,routh
2581,2582,i have just finished watching a latenight movie on tv and to my amazement you were in it,you were playing a hardened criminal,routh
2583,2584,it was so startling to see you on the screen especially in such a menacing role,how different from the man i met,routh
2585,2586,i remember telling you my story,i remember how you listened to me meal after meal,routh
2587,2588,i could not stop talking,i was in agony,routh
2589,2590,i thought my life was over,i wanted it to be over,routh
2591,2592,you may not know it but your listening to my story the way you did contributed to my getting through back then,not that it is been easy,routh
2593,2594,not that it is now,not that it ever will be,routh
2595,2596,the monster i was married to has done ineradicable damage to my family,the disaster was worse than i knew when i was hospitalized,routh
2597,2598,terrible things had been going on for a long time without my knowing anything about them,tragic things involving my little girl,routh
2599,2600,i remember asking you if you would kill him for me,i told you i would pay,routh
2601,2602,i thought because you were so big you could do it,mercifully you did not tell me that i was crazy when i said that but sat there listening to my madness as though i were sane,routh
2603,2604,i thank you for that,but a part of me will never be sane again,routh
2605,2606,it ca not be,it could not be,routh
2607,2608,it should not be,stupidly i sentenced the wrong person to death,routh
2609,2610,the letter went on a single handwritten paragraph stretching loosely over three more big sheets of paper and it was signed sybil van buren,he remembered listening to her storysummoning up his concentration and listening like that to someone other than himself was as close as he had come to acting in a long time and may even have helped him to recover,routh
2611,2612,yes he remembered her and her story and her asking him to kill her husband as though he were a gangster in a movie rather than another patient in a psychiatric hospital who big as he was was as incapable as she of violently ending his own suffering with a gun,people go around killing people in movies all the time but the reason they make all those movies is that for 99,routh
2613,2614,9 percent of the audience it is impossible to do,and if it is that hard to kill someone else someone you have every reason to want to destroy imagine how hard it is to succeed in killing yourself,routh
2615,2616,he had known pegeens parents as good friends before pegeen was born and had seen her first in the hospital as a tiny infant nursing at her mother is breast,they had met when axler and the newly married staplefordshe from michigan she from kansasappeared together in a greenwich village church basement production of playboy of the western world,routh
2617,2618,axler had played the wonderfully wild lead role of christy mahon the wouldbe parricide while the female lead pegeen mike flaherty the strongminded barmaid in her father is pub on the west coast of county mayo had been played by carol stapleford then two months pregnant with a first child asa stapleford had played shawn keogh pegeen is betrothed,when the play is run ended axler had been at the closingnight party to cast his vote for christy as the name for a son and pegeen mike as the name for a daughter when the staplefords baby arrived,routh
2619,2620,it was not likelyparticularly as pegeen mike stapleford had lived as a lesbian since she was twentythreethat when she was forty years old and axler was sixtyfive they would become lovers who would speak on the phone every morning upon awakening and would eagerly spend their free time together at his house where to his delight she appropriated two rooms for her own one of the three bedrooms on the second floor for her things and the downstairs study off the living room for her laptop,there were fireplaces in all the downstairs rooms even one in the kitchen and when pegeen was working in the study she had a fire going all the time,routh
2621,2622,she lived a little over an hour away journeying along winding hilly roads that carried her across farm country to his fifty acres of open fields and the large old blackshuttered white farmhouse enclosed by ancient maples and big ashes and long uneven stone walls,there was nobody but the two of them anywhere nearby,routh
2623,2624,during the first few months they rarely got out of bed before noon,they could not leave each other alone,routh
2625,2626,yet before her arrival he had been sure he was finished finished with acting with women with people finished forever with happiness,he had been in serious physical distress for over a year barely able to walk any distance or to stand or sit for very long because of the spinal pain that he had put up with all his adult life but whose debilitating progress had accelerated with ageand so he was sure he was finished with everything,routh
2627,2628,one of his legs would intermittently go dead so that he could not raise it properly while walking and he would miss a step or a curb and fall opening cuts on his hands and even landing on his face bloodying his lip or his nose,only a few months earlier his best and only local friend an eightyyearold judge who had retired some years back had died of cancer as a result though axler had been based two hours from the city amid the trees and fields for thirty yearsliving there when he was not out somewhere in the world performinghe did not have anyone with whom to talk or to eat a meal let alone share a bed,routh
2629,2630,and he was thinking again about killing himself as often as he had been before being hospitalized a year earlier,every morning when he awoke to his emptiness he determined he could not go another day shorn of his skills alone workless and in persistent pain,routh
2631,2632,once again the focus was down to suicide at the center of the dispossession there was only that,on a frigid gray morning after a week of heavy snowstorms axler left the house for the carport to drive the four miles into town and stock up on groceries,routh
2633,2634,pathways around the house had been kept clear every day by a farmer who did his snowplowing for him but he walked carefully nonetheless wearing snow boots with thick treads and carrying a cane and taking tiny steps to prevent himself from slipping and falling,under his layers of clothes his midsection was enveloped for safety is sake in a stiff back brace,routh
2635,2636,as he started out of the house and headed for the carport he spotted a small longtailed whitish animal standing in the snow between the carport and the barn,it looked at first like a very large rat and then he realized from the shape and color of the furless tail and from the snout that it was a possum about ten inches long,routh
2637,2638,possums are ordinarily nocturnal but this one whose coat looked discolored and scruffy was down on the snowcovered ground in broad daylight,as axler approached the possum waddled feebly off in the direction of the barn and then disappeared into a mound of snow up against the barn is stone foundation,routh
2639,2640,he followed the animalwhich was probably sick and nearing its endand when he got to the mound of snow saw that there was an entry hole cleared at the front,supporting himself with both hands on his cane he kneeled down in the snow to peer inside,routh
2641,2642,the possum had retreated too far back into the hole to be seen but strewn about the front of the cavelike interior was a collection of sticks,he counted them,routh
2643,2644,six sticks,so that is how it is done axler thought,routh
2645,2646,i have got too much,all you need are six,routh
2647,2648,the following morning while he was making his coffee he saw the possum through the kitchen window,the animal was standing on its hind legs by the barn eating snow from a drift pushing gobs of it into its mouth with its front paws,routh
2649,2650,hurriedly he put on his boots and his coat picked up his cane went out the front door and came around to the cleared path by the side of the house facing the barn,from some twenty feet away he called across to the possum in full voice how would you like to play james tyrone,routh
2651,2652,at the guthrie,the possum just kept eating snow,routh
2653,2654,you had be a wonderful james tyrone,after that day nature is little caricature of him came to an end,routh
2655,2656,he never saw the possum againeither it disappeared or perishedthough the snow cave with the six sticks remained intact until the next thaw,then pegeen stopped by,routh
2657,2658,she phoned from the little house she had rented a few miles from prescott a small progressive women is college in western vermont where she had recently taken a teaching job,he lived an hour west across the state line in rural new york,routh
2659,2660,it was twenty years or more since he had seen her as a cheerful undergraduate traveling during her vacation with her mother and father,they had be in his vicinity and stop off for a couple of hours to say hello,routh
