qd1,qd2,question1,question2,label
2987,2988,well she surprised her friend louise,he did not bother to reply that louise was something of a surprise herself,routh
2989,2990,carol is intention clearly was to be mild and friendly but he was sure from the brittleness of her tone that the call was an ordeal and that she and asa were simply doing the right thing which was their way doing the sensible thing that would make pegeen happiest,they did not want to alienate her at forty as they had at twentythree when she had told them she was a lesbian,routh
2991,2992,in fact carol flew in from michigan the following saturday to meet pegeen in new york for lunch,pegeen drove down to the city that morning and got back about eight that night,routh
2993,2994,he had made dinner for them and only when dinner was over did he ask her how it had gone,well what did she say,routh
2995,2996,axler asked,do you want me to be entirely honest,routh
2997,2998,pegeen replied,please he said,routh
2999,3000,all right she said i will try to remember as exactly as i can,it was kind of the benign third degree,routh
3001,3002,there was nothing vulgar or selfserving about her,just mother is flatout kansas candor,routh
3003,3004,go ahead,you want to know everything pegeen said,routh
3005,3006,yes he replied,well first off at the restaurant she breezed right by my tableshe failed to recognize me,routh
3007,3008,i said mother and then she turned back and she said oh my goodness it is my daughter,do not you look pretty,routh
3009,3010,and i said pretty,did not you think i was pretty before,routh
3011,3012,and she said a new hairdo clothes of a kind i never saw you wear before,and i said more feminine you mean,routh
3013,3014,hadecidedly she said yes,it is very flattering dear,routh
3015,3016,how long has this been going on,i told her and she said that is a very nice haircut,routh
3017,3018,it could not have been inexpensive,and i said to her i am just trying something new,routh
3019,3020,and she said i guess you are trying something new in many ways,i came out because i want to be sure that you have thought through all the implications of your affair,routh
3021,3022,i told her that i was not sure anyone ever thinks through being with someone romantically,i told her that it made me very happy right now,routh
3023,3024,and so she said news reached us that he was in a psychiatric hospital,some people say he was there six months some say a yeari do not really know the facts,routh
3025,3026,i told her that you were there for twentysix days a full twelve months ago and that it had to do with performance problems on the stage,i said that you temporarily lost your power to act and separated from your acting you came apart,routh
3027,3028,i said that whatever emotional or mental problems you had then they did not manifest themselves in our life together now,i said you were as sane or saner than anyone i have ever been with and that when we are together you seem stable and quite happy,routh
3029,3030,and she asked is he still in the same bind with his acting,and i said yes and noyou were but i thought that as a result of meeting me and being with me it was no longer the same tragedy it had been,routh
3031,3032,it was now more like an athlete who is been injured and sidelined and is waiting to heal,and she said you do not feel you have to rescue him do you,routh
3033,3034,i assured her that i did not and she asked how you filled your time and i said he sees me,i think he plans to continue seeing me,routh
3035,3036,he reads,he buys me clothes,routh
3037,3038,well she leaped on thatso these are clothes he bought for you,well i would think there might be a certain rescue fantasy working there,routh
3039,3040,i told her that she was making too much of it and that it was just fun for both of us and why could not we leave it at that,i said he is not trying to influence me in any way i do not want to be influenced,routh
3041,3042,she asked  hado you go with him when he buys you clothes,and i said usually,routh
3043,3044,but again i think it makes him happy,and i can see that in him,routh
3045,3046,since it happens to be an experiment i want to conduct as well i told her i do not see why anyone should be concerned,and that is when the tenor of the conversation changed,routh
3047,3048,she said well i have to tell you that i am concerned,you are new to the world of men and it strikes me as strangeor maybe not so strangethat the man you should choose to initiate this new life with is a man twentyfive years older than you are who has been through a breakdown that led to his being institutionalized,routh
3049,3050,and who now is essentially unemployed,all those things do not bode well to me,routh
3051,3052,i told her that it did not seem any worse than the situation i was in before with someone whom i once loved very much and who told me one morning i ca not go on in this body and decided she wanted to be a man,and then i made my speech the speech i had prepared and recited aloud driving down,routh
3053,3054,i said as for his age mother i do not see it as a problem,if i am going to try to be attractive to men and also learn whether i am attracted to men this seems to be the best measure of it,routh
3055,3056,this person is the test,the twentyfive years register with me as twentyfive years more experience than someone would have if i were trying this with a man my own age,routh
3057,3058,we are not talking about getting married,i told youwe are just enjoying each other,routh
3059,3060,i am enjoying him in part because he is twentyfive years older,and she said and he is enjoying you because you are twentyfive years younger,routh
3061,3062,i said  hado not be offended mother but are you at all jealous,and she laughed and said  hadear i am sixtythree and happily married to your father for over forty years,routh
3063,3064,it is true she said and you may get a kick out of knowing this but when i played pegeen mike and simon played christy in the synge play i had a crush on him,who did not,routh
3065,3066,he was wildly attractive energetic exuberant playful he was a big forceful actor a wonderful actor already his talent obviously a huge cut above everyone else is,so yes i had a crush but i was already married and pregnant with you,routh
3067,3068,the crush was something i passed through,i think i have seen him no more than ten times in the intervening years,routh
3069,3070,i respect him enormously as an actor,but i continue to be concerned by that hospital stay,routh
3071,3072,it is no small thing for someone to commit himself to a psychiatric hospital and to be there for however long or short a period it was,look she said for me the important thing is that you are not going into this blind,routh
3073,3074,you do not want to be doing something that for lack of experience a twentyyearold might do,i do not want you to act out of innocence,routh
3075,3076,and i said i am hardly innocent mother,i asked her what she was afraid might happen that could not happen with anyone,routh
3077,3078,and she said what am i afraid of,i am afraid of the fact that he is growing older by the day,routh
3079,3080,that is the way it works,you are sixtyfive and then you are sixtysix and then you are sixtyseven and so on,routh
3081,3082,in a few years he will be seventy,you will be with a seventyyearold man,routh
3083,3084,and it wo not stop there she told me,after that he will become a seventyfiveyearold man,routh
3085,3086,it never stops,it goes on,routh
3087,3088,he will begin to have health problems such as the elderly have and maybe things even worse and you are going to be the person responsible for his care,are you in love with him,routh
3089,3090,she said,i said i thought that i was,routh
3091,3092,and she asked is he in love with you,and i said i thought that you were,routh
3093,3094,i said i think it will be fine mother,it has occurred to me that he has to worry more than i do,routh
3095,3096,that this is a more precarious situation for him than it is for me,she asked how so,routh
3097,3098,i said well as you say i am trying this for the first time,although it is a novelty for him as well it is not nearly as much of one as it is for me,routh
3099,3100,i have been very surprised by how much i have enjoyed it,but i could not yet declare that it is definitely the permutation i will always want,routh
3101,3102,and she said well all right i do not want to go on and on and give this an urgency it does not have and may never have,i just thought it was important for me to see you and i must say once again i am very impressed by your appearance,routh
3103,3104,and i asked her  hadoes it make you think you would still have preferred a daughter who was straight,she said it makes me think that you would prefer not to be a lesbian any longer,routh
3105,3106,you can of course do whatever you like,in your independent youth you educated us about that,routh
3107,3108,but i ca not fail to notice the physical change,you have taken great care that everybody should notice that,routh
3109,3110,you even do your eyes,it is an impressive transformation,routh
3111,3112,that is when i said what do you think dad would think,and she said he could not be here because a new play opens in a few days and he ca not leave it,routh
3113,3114,but he wanted to come to see you and as soon as the play is on he will come if that is all right with you,and then you can ask him directly what he thinks,routh
3115,3116,so there we are,want to go shopping,routh
3117,3118,she said to me,i am admiring your shoes,routh
3119,3120,where had you get them,i told her and she said would you object if i bought a pair like that,routh
3121,3122,want to go with me to get them,and so we took a taxi to madison avenue and she bought a pair of twotoned pinkandbeige patent leather pumps with a pointy toe and a kitten heel in her size,routh
3123,3124,now she is walking around michigan in my prada shoes,she also admired my skirt so we went shopping for a skirt for her cut like mine down in soho,routh
3125,3126,good ending is not it,but late in the afternoon you know what she said before leaving for the airport with her bags from the shopping,routh
3127,3128,this and not the shoes is the true ending,she said what you were trying to do with me at lunch pegeen was make it sound like the sanest and most reasonable arrangement on the planet when of course it is not,routh
3129,3130,but people on the outside are only going to frustrate you if they try to talk you out of what you wake up every day wanting and what is buoying you above everybody is humdrum sameness,i have to tell you that when i first learned of this i thought it was wacky and ill advised,routh
3131,3132,and now that i have spoken with you and spent the day with you and been shopping with you for the first time really since you went off to college now that i have seen that you are completely calm rational and thoughtful about it i still think it is wacky and ill advised,here pegeen stopped,routh
3133,3134,it had taken her close to half an hour to repeat the conversation to him and in that time he had not spoken or moved from his chair nor had he told her to stop on any of those several occasions when he thought he had heard enough,but it was not in his interest to tell her to stopit was in his interest to find out everything to hear everything even if he had to to hear her say i could not yet declare that it is definitely the permutation i will always want,routh
3135,3136,that is it,that is all pegeen said,routh
3137,3138,that is pretty close to what was said,was it better or worse than you expected,routh
3139,3140,he asked,much better,routh
3141,3142,i was very anxious driving down there,well it sounds as though you had no need to be,routh
3143,3144,you handled yourself very well,then i was very anxious coming back about telling you all this and knowing that if i was truthful you were not going to like everything you heard,routh
3145,3146,well there was no need for that either,really,routh
3147,3148,i hope my telling you everything has not turned you against my mother,your mother said what a mother would say,routh
3149,3150,i understand,he laughed and said i ca not say that i disagree with her,routh
3151,3152,softly and flushing as she spoke pegeen said i hope it has not turned you against me,it is made me admire you he said,routh
3153,3154,you did not flinch from anything either in talking with her or now in talking with me,truly,routh
3155,3156,you are not hurt,no,routh
3157,3158,but of course he washurt and angry,he had sat there listening quietlyintently listening as he had been listening all his life offstage and onbut he was particularly stung by carol is clarification of the aging process and the jeopardy in which it placed her daughter,routh
3159,3160,nor however softly he now spoke was he unperturbed by wacky and ill advised,the whole thing disgusted him really,routh
3161,3162,it might be all right if pegeen were twentytwo and there were forty years difference between them but why this peculiar proprietary relationship with an adventurous fortyyearold,and what the hell did a woman of forty care what her parents wanted,routh
3163,3164,a part of them he thought should be happy that she was with him if only from a venal point of view,here is this eminent man with a lot of money who is going to take care of her,routh
3165,3166,after all she is not getting any younger herself,she settles down with someone who is achieved something in lifewhat is so wrong with that,routh
3167,3168,instead the message is do not set yourself up to be caretaker of a crazy old guy,however since pegeen had seemingly rejected carol is account of him he thought it best to stay silent about that as well as everything else that he did not like,routh
3169,3170,what would be the good of attacking her mother for butting in,better to appear to laugh it off,routh
3171,3172,if she should come to see him through her mother is eyes there was nothing he could say or do to stop her anyway,you are wonderful to me pegeen said to him,routh
3173,3174,you are what the doctor ordered,and you to me he said and he left it at that,routh
3175,3176,he did not go on from there to add as for your parents i had just as soon spare them but i ca not arrange my life according to their feelings,their feelings do not matter that much to me frankly and at this stage of the game they really should not matter that much to you either,routh
3177,3178,no he would not take off in that direction,instead he would sit tight and be patient and hope the family would fade away,routh
3179,3180,the next day pegeen devoted to stripping the wallpaper in her study,the wallpaper had been chosen by victoria many years before and though axler did not care about it one way or another pegeen could not stand the look of it and asked if she could take it down,routh
3181,3182,he told her the room was hers to do with as she liked as was the upstairs back bedroom and the bathroom beside it as indeed was every room in the house,he told her he could easily get a painter in to do the job but she insisted on stripping the walls and painting them herself thereby making the study officially hers,routh
3183,3184,she had all the necessary tools for stripping wallpaper at her house and she had brought them with her to begin the job that sunday the very day after her mother down in new york had questioned the wisdom of her being there at all,he must have gone in to watch her removing the wallpaper ten times during the course of the day and each time came away with the same reassuring thought she would not be working away like that if carol had succeeded in persuading her to leave him,routh
3185,3186,she would not be doing what she was doing if she were not planning to stay,that evening pegeen drove back to the college where she had a class to teach early the following morning,routh
3187,3188,when the phone rang around ten on sunday night he thought it was she who was calling to say that she was safely home,it was not,routh
3189,3190,it was the jilted dean,be forewarned mr,routh
3191,3192,famous she is desirable she is audacious and she is utterly ruthless utterly coldhearted incomparably selfish and completely amoral,and with that the dean hung up,routh
3193,3194,the next morning axler dropped off his car to be serviced and the mechanic gave him a ride back home in his tow truck,he would return the car to axler at the end of the day when the job was done,routh
3195,3196,around noon when axler went into the kitchen to make a sandwich for himself he happened to look out the window and saw something dart across the field adjacent to the barn and then disappear behind it,it was a person this time not a possum,routh
3197,3198,he stood back from the kitchen window and waited to see if perhaps there was a second third or fourth person lurking anywhere else,there had been a worrisome series of breakins throughout the county in recent months mainly into unoccupied houses owned by weekenders and he wondered if the absence of a car in his carport had caught the attention of the robbers and made him a target for a daytime theft,routh
3199,3200,quickly he headed for the attic to get his shotgun and load it with shells,then he went back downstairs to survey his property from the kitchen window,routh
3201,3202,a hundred yards to the north on the road that ran perpendicular to his he could see a parked car but it was too far for him to make out whether there was anyone inside it,it was unusual to see a car parked there at any time of the day or nightthere was a thickly wooded hill on the far side of the road and on his side open fields leading up to his barn carport and house,routh
3203,3204,suddenly the person hiding back of the barn came sneaking along the side of the barn and made a rush for the front of the house,from the kitchen he saw that the intruder was a tall thin redheaded woman dressed in jeans and a navy blue ski jacket,routh
3205,3206,she was peering into the living room through a front window,as he was still uncertain whether or not she was alone for the moment he froze the gun in his hands,routh
3207,3208,soon she began to move from one window to the next stopping each time to get a good look at the room inside,he slipped out of the house through the back door and without her seeing him came to within ten feet of where she was staring into one of the living room windows on the south side of the house,routh
3209,3210,aiming the rifle at her he spoke,what can i do for you lady,routh
3211,3212,oh,she cried when she turned and saw him,routh
3213,3214,oh i am sorry,are you alone,routh
3215,3216,yes,i am alone,routh
3217,3218,i am louise renner,you are the dean,routh
3219,3220,yes,she did not look much older than pegeen but she was a good deal taller only inches shorter than he was and what with her erect carriage and the red hair pulled away from her high forehead and knotted severely at the back of her neck there was a heroically statuesque aura to this woman,routh
3221,3222,what do you think you are doing,he asked her,routh
3223,3224,i am trespassing i know,i intended no harm,routh
3225,3226,i thought no one was home,have you been here before,routh
3227,3228,only to drive by,why,routh
3229,3230,could you lower that gun,it is making me very nervous,routh
3231,3232,well you made me nervous peeking into my windows,i am sorry,routh
3233,3234,i apologize,i have been stupid,routh
3235,3236,this is shameful,i will go,routh
3237,3238,what were you up to,you know what i was up to she said,routh
3239,3240,you tell me,i only wanted to see where she goes every weekend,routh
3241,3242,you are in a bad way,you drove from vermont to find that out,routh
3243,3244,she promised we had be together forever and three weeks later she left,i apologize again,routh
3245,3246,this has never happened to me before,i should never have come here,routh
3247,3248,and it probably does not help much your meeting me,it does not,routh
3249,3250,it makes you boil with jealousy he said,with hatred if you want the truth,routh
3251,3252,it is you who phoned last night,i am not completely in charge of myself she replied,routh
3253,3254,you are obsessed so you phone you are obsessed so you stalk,you are a very attractive woman nonetheless,routh
3255,3256,i have never been told that before by a man with a gun,i do not know why she left you for me he said,routh
3257,3258,oh do not you,you are a redhaired valkyrie and i am an old man,routh
3259,3260,an old man who is a star mr,axler,routh
3261,3262,do not pretend to be no one,would you like to come inside,routh
3263,3264,he asked,why,routh
3265,3266,do you want to seduce me too,is that your specialty retooling lesbians,routh
3267,3268,madam it is not i who was the peeping tom,it is not i who phoned her parents in michigan at midnight,routh
3269,3270,it is not i who anonymously phoned mr,famous last night,routh
3271,3272,no need to take the accusatory tone so quickly,i am not myself,routh
3273,3274,do you think she is worth it,no,routh
3275,3276,of course not she said,she is not at all beautiful,routh
3277,3278,she is not that intelligent,and she is not that grown up,routh
3279,3280,she is an unusually childish person for her age,she is a kid really,routh
3281,3282,she turned her montana lover into a man,she is turned me into a beggar,routh
3283,3284,who knows what she is turning you into,she leaves a trail of disaster,routh
3285,3286,where does the power come from,take a guess he said,routh
3287,3288,is it that that makes for disaster,the dean asked,routh
3289,3290,something about her sexually is very potent he said and saw her cringe at the words,but then it could not be easy for the loser to stand there and confront the person who had won,routh
3291,3292,there is plenty that is potent the dean said,she is a girlboy,routh
3293,3294,she is a childadult,there is an adolescent in her that is not grown up,routh
3295,3296,she is a cunning naif,but it is not her sexuality on its own that does itit is us,routh
3297,3298,it is we who endow her with the power to wreck,pegeen is nobody you know,routh
3299,3300,you would not be suffering so if she were nobody,she would not be here if she were nobody,routh
3301,3302,look you might as well step inside,then you can see everything up close,routh
3303,3304,and he could hear more about pegeen seared though her observations would be by pegeen is having exploited her,yes he wanted to hear her speak out of the depths of her wound about the closest person on earth to him,routh
3305,3306,this has been more than enough the dean said,come inside he said,routh
3307,3308,no,are you afraid of me,routh
3309,3310,he asked,i have done something foolish for which i apologize,routh
3311,3312,i have trespassed and i am sorry,and now i had like you to let me go,routh
3313,3314,i am not holding you,you have a way of trying to turn the moral tables on me,routh
3315,3316,but i did not invite you here in the first place,then why do you want me to come inside,routh
3317,3318,because of the triumph it would be to sleep with the woman that pegeen used to sleep with,i have no such ambition,routh
3319,3320,i am satisfied with things as they are,i was being polite,routh
3321,3322,i could offer you a cup of coffee,no the dean said coldly,routh
3323,3324,no you want to fuck me,is that what you want me to want,routh
3325,3326,that is what you want,is that what you came here to try to get me to do,routh
3327,3328,so as to pay pegeen back in kind,all at once she could conceal her misery no longer and burst into tears,routh
3329,3330,too late too late she sobbed,he did not understand what she was referring to but he did not ask,routh
3331,3332,she cried with her face buried in her hands while he turned and with the gun at his side went back into the house through the rear door trying to believe that nothing louise had said about pegeen either there outside the house or the night before on the phone could possibly be taken seriously,when he called pegeen that night he made no reference to what had happened that afternoon nor did he tell pegeen about louise is visit when she came for the weekend nor while they were having sex was he able to keep the redhaired valkyrie out of his mind and the fantasy of what had not happened,routh
3333,3334,the pain from the spinal condition made it impossible for him to fuck her from above or even from the side and so he lay on his back and she mounted him supporting herself on her knees and her hands so as not to lower her weight onto his pelvis,at first she lost all her knowhow up there and he had to guide her with his two hands to give her the idea,routh
3335,3336,i do not know what to do pegeen said shyly,you are on a horse axler told her,routh
3337,3338,ride it,when he worked his thumb into her ass she sighed with pleasure and whispered nobody is ever put anything in there beforeunlikely he whispered backand when later he put his cock in there she took as much as she could of it until she could not take any more,routh
3339,3340,did it hurt,he asked her,routh
3341,3342,it hurt but it is you,often she would hold his cock in her palm afterward and stare as the erection subsided,routh
3343,3344,what are you contemplating,he asked,routh
3345,3346,it fills you up she said the way dildos and fingers do not,it is alive,routh
3347,3348,it is a living thing,she quickly mastered riding the horse and soon while she worked slowly up and down she began to say hit me and when he hit her she said mockingly is that as hard as you can do it,routh
3349,3350,your face is already red,harder she said,routh
3351,3352,okay but why,because i have given you permission to do it,routh
