qd1,qd2,question1,question2,label
1,2,through the fence between the curling flower spaces i could see them hitting,they were coming toward where the flag was and i went along the fence,faulkner
3,4,luster was hunting in the grass by the flower tree,they took the flag out and they were hitting,faulkner
5,6,then they put the flag back and they went to the table and he hit and the other hit,then they went on and i went along the fence,faulkner
7,8,luster came away from the flower tree and we went along the fence and they stopped and we stopped and i looked through the fence while luster was hunting in the grass,here caddie,faulkner
9,10,he hit,they went away across the pasture,faulkner
11,12,i held to the fence and watched them going away,listen at you now,faulkner
13,14,luster said,aint you something thirty three years old going on that way,faulkner
15,16,after i done went all the way to town to buy you that cake,hush up that moaning,faulkner
17,18,aint you going to help me find that quarter so i can go to the show tonight,they were hitting little across the pasture,faulkner
19,20,i went back along the fence to where the flag was,it flapped on the bright grass and the trees,faulkner
21,22,come on,luster said,faulkner
23,24,we done looked there,they aint no more coming right now,faulkner
25,26,les go down to the branch and find that quarter before them niggers finds it,it was red flapping on the pasture,faulkner
27,28,then there was a bird slanting and tilting on it,luster threw,faulkner
29,30,the flag flapped on the bright grass and the trees,i held to the fence,faulkner
31,32,shut up that moaning,luster said,faulkner
33,34,i cant make them come if they aint coming can i,if you dont hush up mammy aint going to have no birthday for you,faulkner
35,36,if you dont hush you know what i going to do,i going to eat that cake all up,faulkner
37,38,eat them candles too,eat all them thirty three candles,faulkner
39,40,come on les go down to the branch,i got to find my quarter,faulkner
41,42,maybe we can find one of they balls,here,faulkner
43,44,here they is,way over yonder,faulkner
45,46,see,he came to the fence and pointed his arm,faulkner
47,48,see them,they aint coming back here no more,faulkner
49,50,come on,we went along the fence and came to the garden fence where our shadows were,faulkner
51,52,my shadow was higher than luster is on the fence,we came to the hroken place and went through it,faulkner
53,54,wait a minute,luster said,faulkner
55,56,you snagged on that nail again,cant you never crawl through here without snagging on that nail,faulkner
57,58,caddy uncaught me and we crawled through,uncle maury said to not let anybody see us so we better stoop over caddy said,faulkner
59,60,stoop over benjy,like this see,faulkner
61,62,we stooped over and crossed the garden where the flowers rasped and rattled against us,the ground was hard,faulkner
63,64,we climbed the fence where the pigs were grunting and snuffing,i expect they are sorry because one of them got killed today caddy said,faulkner
65,66,the ground was hard churned and knotted,keep your hands in your pockets caddy said,faulkner
67,68,or they will get froze,you dont want your hands froze on christmas do you,faulkner
69,70,it is too cold out there,versh said,faulkner
71,72,you dont want to go outdoors,what is it now,faulkner
73,74,mother said,he want to go out doors,faulkner
75,76,versh said,let him go,faulkner
77,78,uncle maury said,it is too cold,faulkner
79,80,mother said,he had better stay in,faulkner
81,82,benjamin,stop that now,faulkner
83,84,it wont hurt him,uncle maury said,faulkner
85,86,you benjamin,mother said,faulkner
87,88,if vou dont be good you will have to go to the kitchen,mammy say keep him out the kitchen today,faulkner
89,90,versh said,she say she got all that cooking to get done,faulkner
91,92,let him go caroline,uncle maury said,faulkner
93,94,you will worry yourself sick over him,i know it,faulkner
95,96,mother said,it is a judgment on me,faulkner
97,98,i sometimes wonder,i know i know,faulkner
99,100,uncle maury said,you must keep your strength up,faulkner
101,102,i will make you a toddy,it just upsets me that much more,faulkner
103,104,mother said,dont you know it does,faulkner
105,106,you will feel better,uncle maury said,faulkner
107,108,wrap him up good boy and take him out for a while,uncle maury went away,faulkner
109,110,versh went away,please hush,faulkner
111,112,mother said,we are trying to get you out as fast as we can,faulkner
113,114,i dont want you to get sick,versh put my overshoes and overcoat on and we took my cap and went out,faulkner
115,116,uncle maury was putting the bottle away in the sideboard in the diningroom,keep him out about half an hour boy,faulkner
117,118,uncle maury said,keep him in the yard now,faulkner
119,120,yes sir,versh said,faulkner
121,122,we dont never let him get off the place,we went out doors,faulkner
123,124,the sun was cold and bright,where you heading for,faulkner
125,126,versh said,you dont think you going to town does you,faulkner
127,128,we went through the rattling leaves,the gate was cold,faulkner
129,130,you better keep them hands in your pockets,versh said,faulkner
131,132,you get them froze onto that gate then what you do,why not you wait for them in the house,faulkner
133,134,he put my hands into my pockets,i could hear him rattling in the leaves,faulkner
135,136,i could smell the cold,the gate was cold,faulkner
137,138,here some hickeynuts,whooey,faulkner
139,140,git up that tree,look here at this squirl benjy,faulkner
141,142,i could not feel the gate at all but i could smell the bright cold,you better put them hands back in your pockets,faulkner
143,144,caddy was walking,then she was running her booksatchel swinging and jouncing behind her,faulkner
145,146,hello benjy,caddy said,faulkner
147,148,she opened the gate and came in and stooped down,caddy smelled like leaves,faulkner
149,150,did you come to meet me,she said,faulkner
151,152,did you come to meet caddy,what did you let him get his hands so cold for versh,faulkner
153,154,i told him to keep them in his pockets,versh said,faulkner
155,156,holding on to that ahun gate,did you come to meet caddy,faulkner
157,158,she said rubbing my hands,what is it,faulkner
159,160,what are you trying to tell caddy,caddy smelled like trees and like when she says we were asleep,faulkner
161,162,what are you moaning about luster said,you can watch them again when we get to the branch,faulkner
163,164,here,here is you a jimson weed,faulkner
165,166,he gave me the flower,we went through the fence into the lot,faulkner
167,168,what is it,caddy said what are you trying to tell caddy,faulkner
169,170,did they send him out versh,could not keep him in,faulkner
171,172,versh said,he kept on until they let him go and he come right straight down here looking through the gate,faulkner
173,174,what is it,caddy said,faulkner
175,176,did you think it would be christmas when i came home from school,is that what you thought,faulkner
177,178,christmas is the day after tomorrow,santy claus benjy,faulkner
179,180,santy claus,come on let is run to the house and get warm,faulkner
181,182,she took my hand and we ran through the bright rustling leaves,we ran up the steps and out of the bright cold into the dark cold,faulkner
183,184,uncle maury was putting the bottle back in the sideboard,he called caddy,faulkner
185,186,caddy said take him in to the fire versh,go with versh,faulkner
187,188,she said,i will come in a minute,faulkner
189,190,we went to the fire,mother said is he cold versh,faulkner
191,192,nome,versh said,faulkner
193,194,take his overcoat and overshoes off,mother said,faulkner
195,196,how many times do i have to tell you not to bring him into the house with his overshoes on,yessum,faulkner
197,198,versh said,hold still now,faulkner
199,200,he took my overshoes off and unbuttoned my coat,caddy said wait versh,faulkner
201,202,cant he go out again mother,i want him to go with me,faulkner
203,204,you had better leave him here,uncle maury said,faulkner
205,206,he is been out enough today,i think you had both better stay in,faulkner
207,208,mother said,it is getting colder dilsey says,faulkner
209,210,oh mother,caddy said,faulkner
211,212,nonsense,uncle maury said,faulkner
213,214,she is been in school all day,she needs the fresh air,faulkner
215,216,run along candace,let him go mother,faulkner
217,218,caddy said,please,faulkner
219,220,you know he will cry,then why did you mention it before him,faulkner
221,222,mother said,why did you come in here,faulkner
223,224,to give him some excuse to worry me again,you have been out enough today,faulkner
225,226,i think you had better sit down here and play with him,let them go caroline,faulkner
227,228,uncle maury said,a little cold wont hurt them,faulkner
229,230,remember you have got to keep your strength up,i know,faulkner
231,232,mother said,nobody knows how i dread christmas,faulkner
233,234,nobody knows,i am not one of those women who can stand things,faulkner
235,236,i wish for jason is and the children is sakes i was stronger,you must do the best you can and not let them worry you,faulkner
237,238,uncle maury said,run along,faulkner
239,240,you two,but dont stay out long now,faulkner
241,242,your mother will worry,yes sir,faulkner
243,244,caddy said,come on benjy,faulkner
245,246,we are going out doors again,she buttoned my coat and we went toward the door,faulkner
247,248,are you going to take that baby out without his overshoes,mother said,faulkner
249,250,do you want to make him sick with the house full of company,i forgot,faulkner
251,252,caddy said,i thought he had them on,faulkner
253,254,we went back,you must think,faulkner
255,256,mother said,hold still now versh said,faulkner
257,258,he put my overshoes on,someday i will be gone and you will have to think for him,faulkner
259,260,now stomp versh said,come here and kiss mother benjamin,faulkner
261,262,caddy took me to mother is chair and mother took my face in her hands and then she held me against her,my poor baby,faulkner
263,264,she said,she let me go,faulkner
265,266,you and versh take good care of him honey,yessum,faulkner
267,268,caddy said,we went out,faulkner
269,270,caddy said you need not go versh,i will keep him for a while,faulkner
271,272,all right,versh said,faulkner
273,274,i aint going out in that cold for no fun,he went on and we stopped in the hall and caddy knelt and put her arms around me and her cold bright face against mine,faulkner
275,276,she smelled like trees,you are not a poor baby,faulkner
277,278,are you,are you,faulkner
279,280,you have got your caddy,have not you got your caddy,faulkner
281,282,cant you shut up that moaning and slobbering luster said,aint you shamed of yourself making all this racket,faulkner
283,284,we passed the carriage house where the carriage was,it had a new wheel,faulkner
285,286,git in now and set still until your maw come,dilsey said,faulkner
287,288,she shoved me into the carriage,t,faulkner
289,290,p,held the reins,faulkner
291,292,clare i dont see how come jason wont get a new surrey,dilsey said,faulkner
293,294,this thing going to fall to pieces under you all some day,look at them wheels,faulkner
295,296,mother came out pulling her veil down,she had some flowers,faulkner
297,298,where is roskus,she said,faulkner
299,300,roskus cant lift his arms today,dilsey said,faulkner
301,302,t,p,faulkner
303,304,can drive all right,i am afraid to,faulkner
305,306,mother said,it seems to me you all could furnish me with a driver for the carriage once a week,faulkner
307,308,it is little enough i ask lord knows,you know just as well as me that roskus got the rheumatism too bad to do more than he have to miss cahline,faulkner
309,310,dilsey said,you come on and get in now,faulkner
311,312,t,p,faulkner
313,314,can drive you just as good as roskus,i am afraid to,faulkner
315,316,mother said,with the baby,faulkner
317,318,dilsey went up the steps,you calling that thing a baby,faulkner
319,320,she said,she took mother is arm,faulkner
321,322,a man big as t,p,faulkner
323,324,come on now if you going,i am afraid to,faulkner
325,326,mother said,they came down the steps and dilsey helped mother in,faulkner
327,328,perhaps it will be the best thing for all of us,mother said,faulkner
329,330,aint you shamed talking that way,dilsey said,faulkner
331,332,dont you know it will take more than a eighteen year old nigger to make queenie run away,she older than him and benjy put together,faulkner
333,334,and dont you start no projecking with queenie you hear me,t,faulkner
335,336,p,if you dont drive to suit miss cahline i going to put roskus on you,faulkner
337,338,he aint too tied up to do that,yessum,faulkner
339,340,t,p,faulkner
341,342,said,i just know something will happen,faulkner
343,344,mother said,stop benjamin,faulkner
345,346,give him a flower to hold,dilsey said,faulkner
347,348,that what he wanting,she reached her hand in,faulkner
349,350,no no,mother said,faulkner
351,352,you will have them all scattered,you hold them,faulkner
353,354,dilsey said,i will get him one out,faulkner
355,356,she gave me a flower and her hand went away,go on now fore quentin see you and have to go too,faulkner
357,358,dilsey said,where is she,faulkner
359,360,mother said,she down to the house playing with luster,faulkner
361,362,dilsey said,go on t,faulkner
363,364,p,drive that surrey like roskus told you now,faulkner
365,366,yessum,t,faulkner
367,368,p,said,faulkner
369,370,hum up queenie,quentin,faulkner
371,372,mother said,dont let  course i is,faulkner
373,374,dilsey said,the carriage jolted and crunched on the drive,faulkner
375,376,i am afraid to go and leave quentin,mother said,faulkner
377,378,i had better not go,t,faulkner
379,380,p,we went through the gate where it did not jolt anymore,faulkner
381,382,t,p,faulkner
383,384,hit queenie with the whip,you t,faulkner
385,386,p,mother said,faulkner
387,388,got to get her going,t,faulkner
389,390,p,said,faulkner
391,392,keep her wake up till we get back to the barn,turn around,faulkner
393,394,mother said,i am afraid to go and leave quentin,faulkner
395,396,cant turn here,t,faulkner
397,398,p,said,faulkner
399,400,then it was broader,cant you turn here,faulkner
401,402,mother said,all right,faulkner
403,404,t,p,faulkner
405,406,said,we began to turn,faulkner
407,408,you t,p,faulkner
409,410,mother said clutching me,i got to turn around some how,faulkner
411,412,t,p,faulkner
413,414,said,whoa queenie,faulkner
415,416,we stopped,you will turn us over,faulkner
417,418,mother said,what you want to do then,faulkner
419,420,t,p,faulkner
421,422,said,i am afraid for you to try to turn around,faulkner
423,424,mother said,get up queenie,faulkner
425,426,t,p,faulkner
427,428,said,we went on,faulkner
429,430,i just know dilsey will let something happen to quentin while i am gone,mother said,faulkner
431,432,we must hurry back,hum up there,faulkner
433,434,t,p,faulkner
435,436,said,he hit queenie with the whip,faulkner
437,438,you t,p,faulkner
439,440,mother said clutching me,i could hear qucenie is feet and the bright shapes went smooth and steady on both sides the shadows of them flowing across queenie is back,faulkner
441,442,they went on like the bright tops of wheels,then those on one side stopped at the tall white post where the soldier was,faulkner
443,444,but on the other side they went on smooth and steady but a little slower,what do you want,faulkner
445,446,jason said,he had his hands in his pockets and a pencil behind his ear,faulkner
447,448,we are going to the cemetery,mother said,faulkner
449,450,all right,jason said,faulkner
451,452,i dont aim to stop you do i,was that all you wanted with me just to tell me that,faulkner
453,454,i know you wont come,mother said,faulkner
455,456,i had feel safer if you would,safe from what,faulkner
457,458,jason said,father and quentin cant hurt you,faulkner
459,460,mother put her handkerchief under her veil,stop it mother,faulkner
461,462,jason said,do you want to get that damn looney to bawling in the middle of the square,faulkner
463,464,drive on t,p,faulkner
465,466,hum up queenie,t,faulkner
467,468,p,said,faulkner
469,470,it is a judgment on me,mother said,faulkner
471,472,but i will be gone too soon,here,faulkner
473,474,jason said,whoa,faulkner
475,476,t,p,faulkner
477,478,said,jason said uncle maury is drawing on you for fifty,faulkner
479,480,what do you want to do about it,why ask me,faulkner
481,482,mother said,i dont have any say so,faulkner
483,484,i try not to worry you and dilsey,i will be gone soon and then you  go on t,faulkner
485,486,p,jason said,faulkner
487,488,hum up queenie,t,faulkner
489,490,p,said,faulkner
491,492,the shapes flowed on,the ones on thc other side began again bright and fast and smooth like when caddy says we are going to sleep,faulkner
493,494,cry baby luster said,aint you shamed,faulkner
495,496,we went through the barn,the stalls were all open,faulkner
497,498,you aint got no spotted pony to ride now luster said,the floor was dry and dusty,faulkner
499,500,the roof was falling,the slanting holes were full of spinning yellow,faulkner
501,502,what do you want to go that way for,you want to get your head knocked off with one of them balls,faulkner
503,504,keep your hands in your pockets,caddy said,faulkner
505,506,or they will be froze,you dont want your hands froze on christmas do you,faulkner
507,508,we went around the barn,the big cow and the little one were standing in the door and we could hear prince and queenie and fancy stomping inside the barn,faulkner
509,510,if it was not so cold we had ride fancy,caddy said,faulkner
511,512,but it is too cold to hold on today,then we could seethe branch where the smoke was blowing,faulkner
513,514,that is where they are killing the pig,caddy said,faulkner
515,516,we can come back by there and see them,we went down the hill,faulkner
517,518,you want to carry the letter,caddy said,faulkner
519,520,you can carry it,she took the letter out of her pocket and put it in mine,faulkner
521,522,it is a christmas present,caddy said,faulkner
523,524,uncle maury is going to surprise mrs patterson with it,we got to give it to her without letting anybody see it,faulkner
525,526,keep your hands in your pockets good now,we came to the branch,faulkner
527,528,it is froze,caddy said,faulkner
529,530,look,she broke the top of the water and held a piece of it against my face,faulkner
531,532,ice,that means how cold it is,faulkner
533,534,she helped me across and we went up the hill,we cant even tell mother and father,faulkner
535,536,you know what i think it is,i think it is a surprise for mother and father and mr patterson both because mr patterson sent you some candy,faulkner
537,538,do you remember when mr patterson sent you some candy last summer,there was a fence,faulkner
539,540,the vine was dry and the wind rattled in it,only i dont see why uncle maury did not send versh,faulkner
541,542,caddy said,versh wont tell,faulkner
543,544,mrs patterson was looking out the window,you wait here,faulkner
545,546,caddy said,wait right here now,faulkner
547,548,i will be back in a minute,give me the letter,faulkner
549,550,she took the letter out of my pocket,keep your hands in your pockets,faulkner
551,552,she climbed the fence with the letter in her hand and went through the brown rattling flowers,mrs patterson came to the door and opened it and stood there,faulkner
553,554,mr patterson was chopping in the green flowers,he stopped chopping and looked at me,faulkner
555,556,mrs patterson came across the garden running,when i saw her eyes i began to cry,faulkner
557,558,you idiot mrs patterson said i told him never to send you alone again,give it to me,faulkner
559,560,quick,mr patterson came fast with the hoc,faulkner
561,562,mrs patterson leaned across the fence reaching her hand,she was trying to climb the fence,faulkner
563,564,give it to me she said give it to me,mr patterson climbed the fence,faulkner
565,566,he took the letter,mrs patterson is dress was caught on the fence,faulkner
567,568,i saw her eyes again and i ran down the hill,they aint nothing over yonder but houses,faulkner
569,570,luster said,we going down to the branch,faulkner
571,572,they were washing down at the branch,one of them was singing,faulkner
573,574,i could smell the clothes flapping and the smoke blowing across the branch,you stay down here,faulkner
575,576,luster said,you aint got no business up yonder,faulkner
577,578,them folks hit you sho,what he want to do,faulkner
579,580,he dont know what he want to do,luster said,faulkner
581,582,he think he want to go up yonder where they knocking that hall,you sit down here and play with your jimson weed,faulkner
583,584,look at them chillen playing in the branch if you got to look at something,how come you cant behave yourself like folks,faulkner
585,586,i sat down on the bank where they were washing and the smoke blowing blue,is you all seen anything of a quarter down here,faulkner
587,588,luster said,what quarter,faulkner
589,590,the one i had here this morning,luster said,faulkner
591,592,i lost it somewhere,it fell through this here hole in my pocket,faulkner
593,594,if i dont find it i cant go to the show tonight,where had you get a quarter boy,faulkner
595,596,find it in white folks pocket while they aint looking,got it at the getting place,faulkner
597,598,luster said plenty more where that one come ftom,only i got to find that one,faulkner
599,600,is you all found it yet,i aint studying no quarter,faulkner
601,602,i got my own business to tend to,come on here,faulkner
603,604,luster said,help me look for it,faulkner
605,606,he would not know a quarter if he was to see it would he,he can help look just the same,faulkner
607,608,luster said,you all going to the show tonight,faulkner
609,610,dont talk to me about no show,time i get done over this here tub i be too tired to lift my hand to do nothing,faulkner
611,612,i bet you be there,luster said,faulkner
613,614,i bet you was there last night,i bet you all be right there when that tent open,faulkner
615,616,be enough niggers there without me,was last night,faulkner
617,618,nigger is money good as white folks i reckon,white folks gives nigger money because know first white man comes along with a band going to get it all back so nigger can go to work for some more,faulkner
619,620,aint nobody going make you go to that show,aint yet,faulkner
621,622,aint thought of it i reckon,what you got against white folks,faulkner
623,624,aint got nothing against them,i goes my way and lets white folks go theirs,faulkner
625,626,i aint studying that show,got a man in it can play a tune on a saw,faulkner
627,628,play it like a banjo,you go last night,faulkner
629,630,luster said,i going tonight if i can find where i lost that quarter,faulkner
631,632,you going take him with you i reckon,me,faulkner
633,634,luster said,you reckon i be found anywhere with him time he start bellering,faulkner
635,636,what does you do when he start bellering,i whips him,faulkner
637,638,luster said,he sat down and rolled up his overalls,faulkner
639,640,they played in the branch,you all found any balls yet,faulkner
641,642,luster said,aint you talking biggity,faulkner
643,644,i bet you better not let your grandmammy hear you talking like that,luster got into the branch where they were playing,faulkner
645,646,he hunted in the water along the bank,i had it when we was down here this morning,faulkner
647,648,luster said,where bouts you lose it,faulkner
649,650,right out this here hole in my pocket,luster said,faulkner
651,652,they hunted in the branch,then they all stood up quick and stopped then they splashed and fought in the branch,faulkner
653,654,luster got it and they squatted in the water looking up the hill through the bushes,where is they,faulkner
655,656,luster said,aint in sight yet,faulkner
657,658,luster put it in his pocket,they came down the hill,faulkner
659,660,did a hall come down here,it ought to be in the water,faulkner
661,662,did not any of you boys see it or hear it,aint heard nothing come down here,faulkner
663,664,luster said,heard something hit that tree up yonder,faulkner
665,666,dont know which way it went,they looked in the branch,faulkner
667,668,hell,look along the branch,faulkner
669,670,it came down here,i saw it,faulkner
671,672,they looked along the branch,then they went back up the hill,faulkner
673,674,have you got that ball,the boy said,faulkner
675,676,what i want with it,luster said,faulkner
677,678,i aint seen no ball,the boy got in the water,faulkner
679,680,he went on,he turned and looked at luster again,faulkner
681,682,he went on down the branch,the man said caddie up the hill,faulkner
683,684,the boy got out of the water and went up the hill,now just listen at you,faulkner
685,686,luster said,hush up,faulkner
687,688,what he moaning about now,lawd knows,faulkner
689,690,luster said,he just starts like that,faulkner
691,692,he been at it all morning,cause it his birthday i reckon,faulkner
693,694,how old he,he thirty three,faulkner
695,696,luster said,thirty three this morning,faulkner
697,698,you mean he been three years old thirty years,i going by what mammy say,faulkner
699,700,luster said,i dont know,faulkner
701,702,we going to have thirty three candles on a cake anyway,little cake,faulkner
703,704,wont hardly hold them,hush up,faulkner
705,706,come on back here,he came and caught my arm,faulkner
707,708,you old looney,he said,faulkner
709,710,you want me to whip you,i bet you will,faulkner
